date,path,title,count,uniques
2021-06-25,/UAL-RE/data-viz-challenge,GitHub - UAL-RE/data-viz-challenge: Repository for Data Visualization Chall...,1,1
2021-06-25,/UAL-RE/figstats/issues/1,Main API functionality to query for Figshare stats 路 Issue #1 路 UAL-RE/figs...,1,1
2021-06-25,/UAL-RE/LD-Cool-P/releases,Releases 路 UAL-RE/LD-Cool-P,60,1
2021-06-25,/UAL-RE/LD-Cool-P/pulls,Pull requests 路 UAL-RE/LD-Cool-P,39,2
2021-06-25,/UAL-RE/LD-Cool-P,UAL-RE/LD-Cool-P: Python tool to enable data curation,21,5
2021-06-25,/UAL-RE/LD-Cool-P/issues,Issues 路 UAL-RE/LD-Cool-P,14,2
2021-06-25,/UAL-RE/LD-Cool-P/pull/223,Allow for downloading only the metadata by zoidy 路 Pull Request #223 路 UAL-OD...,14,1
2021-06-25,/UAL-RE/LD-Cool-P/pull/223/files,Allow for downloading only the metadata by zoidy 路 Pull Request #223 路 UAL-OD...,11,1
2021-06-25,/UAL-RE/LD-Cool-P/issues/162,Bug: Q_EED does not work with Q_PopulateResponse 路 Issue #162 路 UAL-RE/LD-C...,8,5
2021-06-25,/UAL-RE/LD-Cool-P/issues/160,Enhancement: Dump JSON metadata from Qualtrics API 路 Issue #160 路 UAL-RE/LD...,5,2
2021-06-25,/UAL-RE/LD-Cool-P/issues/55,Bug: Handling of multiple deposits from one depositor 路 Issue #55 路 UAL-RE/...,5,1
2021-06-25,/UAL-RE/LD-Cool-P/pull/225,Enhancement: Double digit for version by astrochun 路 Pull Request #225 路 UAL-...,5,1
2021-06-25,/UAL-RE/ldcoolp-figshare,UAL-RE/ldcoolp-figshare: Python tool using the Figshare API for data curation,2,1
2021-06-25,/UAL-RE/ldcoolp-figshare/graphs/traffic,Traffic 路 UAL-RE/ldcoolp-figshare,1,1
2021-06-25,/UAL-RE/ldcoolp-figshare/issues,Issues 路 UAL-RE/ldcoolp-figshare,1,1
2021-06-25,/UAL-RE/ldcoolp-figshare/issues/18,Update URL paths for LD-Cool-P 路 Issue #18 路 UAL-RE/ldcoolp-figshare,1,1
2021-06-25,/UAL-RE/ldcoolp-figshare/pulse,Pulse 路 UAL-RE/ldcoolp-figshare,1,1
2021-06-25,/UAL-RE/redata-commons,UAL-RE/redata-commons: Commons code used by ReDATA codebases,1,1
2021-06-25,/UAL-RE/redata-commons/issues,Issues 路 UAL-RE/redata-commons,1,1
2021-06-25,/UAL-RE/redata-commons/pulls,Pull requests 路 UAL-RE/redata-commons,1,1
2021-06-25,/UAL-RE/ReM/blob/61aed9b92ecfdd983fd1d05d01bb95c5b5532286/main.py,ReM/main.py at 61aed9b92ecfdd983fd1d05d01bb95c5b5532286 路 UAL-...,3,3
2021-06-25,/UAL-RE/ReM/blob/61aed9b92ecfdd983fd1d05d01bb95c5b5532286/readme_tool/figshare.py,ReM/figshare.py at 61aed9b92ecfdd983fd1d05d01bb95c5b5532286 路 ...,2,2
2021-06-25,/UAL-RE/ReM/issues,Issues 路 UAL-RE/ReM,1,1
2021-06-25,/UAL-RE/ReM/pull/4,Module to retrieve Figshare metadata for public deposit (no token) by astroch...,1,1
2021-06-25,/UAL-RE/ReM/pull/4/files,Module to retrieve Figshare metadata for public deposit (no token) by astroch...,1,1
2021-06-25,/UAL-RE/ReM/pulls,Pull requests 路 UAL-RE/ReM,1,1
2021-06-25,/UAL-RE/ReQUIAM,UAL-RE/ReQUIAM: Identity and Access Management backend software for UA Rese...,4,3
2021-06-25,/UAL-RE/ReQUIAM/pulls,Pull requests 路 UAL-RE/ReQUIAM,3,2
2021-06-25,/UAL-RE/ReQUIAM/blob/master/requiam/commons.py,ReQUIAM/commons.py at master 路 UAL-RE/ReQUIAM,1,1
2021-06-25,/UAL-RE/ReQUIAM/blob/master/requiam/delta.py,ReQUIAM/delta.py at master 路 UAL-RE/ReQUIAM,1,1
2021-06-25,/UAL-RE/ReQUIAM/blob/master/requiam/ldap_query.py,ReQUIAM/ldap_query.py at master 路 UAL-RE/ReQUIAM,1,1
2021-06-25,/UAL-RE/ReQUIAM/blob/master/requiam/manual_override.py,ReQUIAM/manual_override.py at master 路 UAL-RE/ReQUIAM,1,1
2021-06-25,/UAL-RE/ReQUIAM/blob/master/scripts/add_grouper_groups,ReQUIAM/add_grouper_groups at master 路 UAL-RE/ReQUIAM,1,1
2021-06-25,/UAL-RE/ReQUIAM/tree/master/requiam,ReQUIAM/requiam at master 路 UAL-RE/ReQUIAM,1,1
2021-06-25,/UAL-RE/ReQUIAM/tree/master/scripts,ReQUIAM/scripts at master 路 UAL-RE/ReQUIAM,1,1
2021-06-25,/UAL-RE/ReQUIAM_csv,UAL-RE/ReQUIAM_csv: Construct list of research themes and organization mapp...,4,2
2021-06-25,/UAL-RE/ReQUIAM_csv/issues,Issues 路 UAL-RE/ReQUIAM_csv,3,1
2021-06-25,/UAL-RE/ReQUIAM_csv/commit/ac897392ea09c5c69e5cdb184bb3cfe579b7b64d,Updates to CSV file (iss #37) 路 UAL-RE/ReQUIAM_csv@ac89739,1,1
2021-06-25,/UAL-RE/uptime/issues,Issues 路 UAL-RE/uptime,3,1
2021-06-25,/UAL-RE/uptime,GitHub - UAL-RE/uptime: Uptime monitoring with @upptime,1,1
2021-06-25,/UAL-RE/uptime/issues/76, Campus Repository is down 路 Issue #76 路 UAL-RE/uptime,1,1
