date,path,title,count,uniques
2021-06-30,/UAL-RE/data-service-landscape-scan/issues,Issues 路 UAL-RE/data-service-landscape-scan,4,2
2021-06-30,/UAL-RE/data-service-landscape-scan,UAL-RE/data-service-landscape-scan: Scan of data services at academic libra...,3,2
2021-06-30,/UAL-RE/data-service-landscape-scan/issues/5,Add Arizona-colored version of # services vs. salaries 路 Issue #5 路 UAL-RE/...,2,2
2021-06-30,/UAL-RE/data-service-landscape-scan/issues/new,New Issue 路 UAL-RE/data-service-landscape-scan,2,1
2021-06-30,/UAL-RE/data-service-landscape-scan/issues/4,Test service likelihood based on resourcing 路 Issue #4 路 UAL-RE/data-servic...,1,1
2021-06-30,/UAL-RE/data-service-landscape-scan/issues/6,Add Arizona-colored version of service ranks 路 Issue #6 路 UAL-RE/data-servi...,1,1
2021-06-30,/UAL-RE/data-service-landscape-scan/search,Search 路 UAL-RE,1,1
2021-06-30,/UAL-RE/data-viz-challenge,UAL-RE/data-viz-challenge: Repository for Data Visualization Challenge webs...,12,2
2021-06-30,/UAL-RE/data-viz-challenge/search,Search 路 UAL-RE,4,1
2021-06-30,/UAL-RE/data-viz-challenge/pull/9,Org rename by astrochun 路 Pull Request #9 路 UAL-RE/data-viz-challenge,3,2
2021-06-30,/UAL-RE/data-viz-challenge/pull/9/files,Org rename by astrochun 路 Pull Request #9 路 UAL-RE/data-viz-challenge,2,2
2021-06-30,/UAL-RE/data-viz-challenge/commits/master,Commits 路 UAL-RE/data-viz-challenge,2,1
2021-06-30,/UAL-RE/data-viz-challenge/watchers,Watchers 路 UAL-RE/data-viz-challenge,2,1
2021-06-30,/UAL-RE/data-viz-challenge/branches,Branches 路 UAL-RE/data-viz-challenge,1,1
2021-06-30,/UAL-RE/data-viz-challenge/commit/4401484d5f7ca40ec841656abe2ef1d50f83e6e2,Merge branch 'master' of github.com:UAL-RE/data-viz-challenge 路 UAL-RE/da...,1,1
2021-06-30,/UAL-RE/data-viz-challenge/commit/9423c3e25c39cf7e10f1accd6e06cc1845721156,Merge pull request #9 from UAL-RE/org_rename 路 UAL-RE/data-viz-challenge@...,1,1
2021-06-30,/UAL-RE/data-viz-challenge/issues,Issues 路 UAL-RE/data-viz-challenge,1,1
2021-06-30,/UAL-RE/data-viz-evaluations,UAL-RE/data-viz-evaluations: Code for processing data visualization submiss...,4,1
2021-06-30,/UAL-RE/data-viz-evaluations/search,Search 路 UAL-RE,3,1
2021-06-30,/UAL-RE/figstats,UAL-RE/figstats: Python software to retrieve statistics for public datasets...,1,1
2021-06-30,/UAL-RE/figstats/issues/1,Main API functionality to query for Figshare stats 路 Issue #1 路 UAL-RE/figs...,1,1
2021-06-30,/UAL-RE/github-stats,UAL-RE/github-stats: GitHub stats for UAL-RE,8,1
2021-06-30,/UAL-RE/github-stats/actions/runs/975616698,Update data: 2021-06-26 路 UAL-RE/github-stats@5ca9eb6,3,1
2021-06-30,/UAL-RE/github-stats/tree/main/data,github-stats/data at main 路 UAL-RE/github-stats,3,1
2021-06-30,/UAL-RE/github-stats/actions,Actions 路 UAL-RE/github-stats,2,1
2021-06-30,/UAL-RE/github-stats/blob/main/.github/workflows/gh-pages-deploy.yml,github-stats/gh-pages-deploy.yml at main 路 UAL-RE/github-stats,2,1
2021-06-30,/UAL-RE/github-stats/commit/97afb64d226fc0c9e0b61cc259204448370c24b9,Update data: 2021-06-27 路 UAL-RE/github-stats@97afb64,2,1
2021-06-30,/ual-odis/github-stats,UAL-RE/github-stats: GitHub stats for UAL-RE,1,1
2021-06-30,/UAL-RE/github-stats/search,Search 路 UAL-RE,1,1
2021-06-30,/UAL-RE/github-stats/tree/main/.github/workflows,github-stats/.github/workflows at main 路 UAL-RE/github-stats,1,1
2021-06-30,/UAL-RE/LD-Cool-P/releases,Releases 路 UAL-RE/LD-Cool-P,64,1
2021-06-30,/UAL-RE/LD-Cool-P/pulls,Pull requests 路 UAL-RE/LD-Cool-P,61,2
2021-06-30,/UAL-RE/LD-Cool-P,UAL-RE/LD-Cool-P: Python tool to enable data curation,35,4
2021-06-30,/UAL-RE/LD-Cool-P/pull/223,Allow for downloading only the metadata by zoidy 路 Pull Request #223 路 UAL-OD...,17,1
2021-06-30,/UAL-RE/LD-Cool-P/issues,Issues 路 UAL-RE/LD-Cool-P,16,2
2021-06-30,/UAL-RE/LD-Cool-P/pull/225,Enhancement: Double digit for version by astrochun 路 Pull Request #225 路 UAL-...,15,1
2021-06-30,/UAL-RE/LD-Cool-P/pull/223/files,Allow for downloading only the metadata by zoidy 路 Pull Request #223 路 UAL-OD...,13,1
2021-06-30,/UAL-RE/LD-Cool-P/pull/226,Enhancement: Dump JSON metadata from Qualtrics API by astrochun 路 Pull Reques...,10,1
2021-06-30,/UAL-RE/LD-Cool-P/issues/162,Bug: Q_EED does not work with Q_PopulateResponse 路 Issue #162 路 UAL-RE/LD-C...,8,5
2021-06-30,/UAL-RE/LD-Cool-P/pull/225/checks,Enhancement: Double digit for version by astrochun 路 Pull Request #225 路 UAL-...,6,1
2021-06-30,/UAL-RE/ldcoolp-figshare/actions,Actions 路 UAL-RE/ldcoolp-figshare,5,1
2021-06-30,/UAL-RE/ldcoolp-figshare/issues,Issues 路 UAL-RE/ldcoolp-figshare,5,1
2021-06-30,/UAL-RE/ldcoolp-figshare,UAL-RE/ldcoolp-figshare: Python tool using the Figshare API for data curation,4,1
2021-06-30,/UAL-RE/ldcoolp-figshare/issues/18,Update URL paths for LD-Cool-P 路 Issue #18 路 UAL-RE/ldcoolp-figshare,4,1
2021-06-30,/UAL-RE/ldcoolp-figshare/pull/25,Org rename by astrochun 路 Pull Request #25 路 UAL-RE/ldcoolp-figshare,2,1
2021-06-30,/UAL-RE/ldcoolp-figshare/pulls,Pull requests 路 UAL-RE/ldcoolp-figshare,2,1
2021-06-30,/UAL-RE/ldcoolp-figshare/graphs/traffic,Traffic 路 UAL-RE/ldcoolp-figshare,1,1
2021-06-30,/UAL-RE/ldcoolp-figshare/milestones,Milestones - UAL-RE/ldcoolp-figshare,1,1
2021-06-30,/UAL-RE/ldcoolp-figshare/pulse,Pulse 路 UAL-RE/ldcoolp-figshare,1,1
2021-06-30,/UAL-RE/ldcoolp-figshare/tree/main/.github/workflows,ldcoolp-figshare/.github/workflows at main 路 UAL-RE/ldcoolp-figshare,1,1
2021-06-30,/UAL-RE/ReBACH,UAL-RE/ReBACH: Python-based tool to enable data preservation to a cloud-hos...,1,1
2021-06-30,/UAL-RE/ReBACH/pull/2/files,Org rename by astrochun 路 Pull Request #2 路 UAL-RE/ReBACH 路 GitHub,1,1
2021-06-30,/UAL-RE/redata-commons/actions,Actions 路 UAL-RE/redata-commons,7,1
2021-06-30,/UAL-RE/redata-commons/pulls,Pull requests 路 UAL-RE/redata-commons,5,1
2021-06-30,/UAL-RE/redata-commons/pull/20/files,Org rename by astrochun 路 Pull Request #20 路 UAL-RE/redata-commons,3,1
2021-06-30,/UAL-RE/redata-commons,UAL-RE/redata-commons: Commons code used by ReDATA codebases,2,1
2021-06-30,/UAL-RE/redata-commons/actions/runs/984089075,Bump version: v0.4.1 -> v0.4.2 路 UAL-RE/redata-commons@6aa686a,2,1
2021-06-30,/UAL-RE/redata-commons/pull/20,Org rename by astrochun 路 Pull Request #20 路 UAL-RE/redata-commons,2,1
2021-06-30,/UAL-RE/redata-commons/actions/runs/984089078,Bump version: v0.4.1 -> v0.4.2 路 UAL-RE/redata-commons@6aa686a,1,1
2021-06-30,/UAL-RE/redata-commons/blob/main/.github/workflows/pypi-publish.yml,redata-commons/pypi-publish.yml at main 路 UAL-RE/redata-commons,1,1
2021-06-30,/UAL-RE/redata-commons/blob/main/.github/workflows/python-package.yml,redata-commons/python-package.yml at main 路 UAL-RE/redata-commons,1,1
2021-06-30,/UAL-RE/redata-commons/blob/main/.github/workflows/sphinx-build.yml,redata-commons/sphinx-build.yml at main 路 UAL-RE/redata-commons,1,1
2021-06-30,/UAL-RE/redata-docs/pull/3,Org rename by astrochun 路 Pull Request #3 路 UAL-RE/redata-docs,3,2
2021-06-30,/UAL-RE/redata-docs/pull/3/files,Org rename by astrochun 路 Pull Request #3 路 UAL-RE/redata-docs,2,2
2021-06-30,/UAL-RE/redata-docs/pull/3/checks,Org rename by astrochun 路 Pull Request #3 路 UAL-RE/redata-docs,1,1
2021-06-30,/UAL-RE/redata-docs/pulls,Pull requests 路 UAL-RE/redata-docs,1,1
2021-06-30,/ualibraries/redata_iac/pull/31,Aliases for metadata-only downloads by zoidy 路 Pull Request #31 路 ualibraries...,15,1
2021-06-30,/ualibraries/redata_iac,ualibraries/redata_iac: Infrastructure as Code (IaC) resources for ReDATA,10,2
2021-06-30,/ualibraries/redata_iac/pull/31/files,Aliases for metadata-only downloads by zoidy 路 Pull Request #31 路 ualibraries...,8,1
2021-06-30,/ualibraries/redata_iac/pulls,Pull requests 路 ualibraries/redata_iac,8,1
2021-06-30,/ualibraries/redata-iac,ualibraries/redata-iac: Infrastructure as Code (IaC) resources for ReDATA,1,1
2021-06-30,/ualibraries/redata_iac/blob/master/ansible/bashrc_ldcoolp_alias_setup.yml,redata_iac/bashrc_ldcoolp_alias_setup.yml at master 路 ualibraries/redata_iac,1,1
2021-06-30,/ualibraries/redata_iac/commit/4c63aef6d43730f3ba347e679b37430cd6aa0984,Update ansible/bashrc_ldcoolp_alias_setup.yml 路 ualibraries/redata_iac@4c63aef,1,1
2021-06-30,/ualibraries/redata_iac/commit/be5167734eb3374e00e308de82945e8cc08cf82c,Update ansible/bashrc_ldcoolp_alias_setup.yml 路 ualibraries/redata_iac@be51677,1,1
2021-06-30,/ualibraries/redata_iac/pull/31/commits,Aliases for metadata-only downloads by zoidy 路 Pull Request #31 路 ualibraries...,1,1
2021-06-30,/ualibraries/redata_iac/releases,Releases 路 ualibraries/redata_iac,1,1
2021-06-30,/UAL-RE/ReM/blob/61aed9b92ecfdd983fd1d05d01bb95c5b5532286/main.py,ReM/main.py at 61aed9b92ecfdd983fd1d05d01bb95c5b5532286 路 UAL-...,4,4
2021-06-30,/UAL-RE/ReM,UAL-RE/ReM: A Python web UI built on FastAPI to gather metad...,4,1
2021-06-30,/UAL-RE/ReM/actions,Actions 路 UAL-RE/ReM,4,1
2021-06-30,/UAL-RE/ReM/search,Search 路 UAL-RE,4,1
2021-06-30,/UAL-RE/ReM/blob/61aed9b92ecfdd983fd1d05d01bb95c5b5532286/readme_tool/figshare.py,ReM/figshare.py at 61aed9b92ecfdd983fd1d05d01bb95c5b5532286 路 ...,3,3
2021-06-30,/UAL-RE/ReM/actions/runs/980507751,Org rename 路 UAL-RE/ReM@0eae882,3,1
2021-06-30,/UAL-RE/ReM/issues,Issues 路 UAL-RE/ReM,1,1
2021-06-30,/UAL-RE/ReM/pull/19,Org rename by astrochun 路 Pull Request #19 路 UAL-RE/ReM,1,1
2021-06-30,/UAL-RE/ReM/pull/4,Module to retrieve Figshare metadata for public deposit (no token) by astroch...,1,1
2021-06-30,/UAL-RE/ReM/pull/4/files,Module to retrieve Figshare metadata for public deposit (no token) by astroch...,1,1
2021-06-30,/UAL-RE/ReQUIAM,UAL-RE/ReQUIAM: Identity and Access Management backend software for UA Rese...,5,2
2021-06-30,/UAL-RE/ReQUIAM/pulls,Pull requests 路 UAL-RE/ReQUIAM,3,2
2021-06-30,/UAL-RE/ReQUIAM/milestones,Milestones - UAL-RE/ReQUIAM,2,1
2021-06-30,/UAL-RE/ReQUIAM/blob/master/requiam/commons.py,ReQUIAM/commons.py at master 路 UAL-RE/ReQUIAM,1,1
2021-06-30,/UAL-RE/ReQUIAM/blob/master/requiam/delta.py,ReQUIAM/delta.py at master 路 UAL-RE/ReQUIAM,1,1
2021-06-30,/UAL-RE/ReQUIAM/blob/master/requiam/ldap_query.py,ReQUIAM/ldap_query.py at master 路 UAL-RE/ReQUIAM,1,1
2021-06-30,/UAL-RE/ReQUIAM/blob/master/requiam/manual_override.py,ReQUIAM/manual_override.py at master 路 UAL-RE/ReQUIAM,1,1
2021-06-30,/UAL-RE/ReQUIAM/blob/master/scripts/add_grouper_groups,ReQUIAM/add_grouper_groups at master 路 UAL-RE/ReQUIAM,1,1
2021-06-30,/UAL-RE/ReQUIAM/issues,Issues 路 UAL-RE/ReQUIAM,1,1
2021-06-30,/UAL-RE/ReQUIAM/pull/154,Org rename by astrochun 路 Pull Request #154 路 UAL-RE/ReQUIAM,1,1
2021-06-30,/UAL-RE/ReQUIAM_csv,UAL-RE/ReQUIAM_csv: Construct list of research themes and organization mapp...,6,1
2021-06-30,/UAL-RE/ReQUIAM_csv/issues,Issues 路 UAL-RE/ReQUIAM_csv,3,1
2021-06-30,/UAL-RE/ReQUIAM_csv/actions,Actions 路 UAL-RE/ReQUIAM_csv,1,1
2021-06-30,/UAL-RE/ReQUIAM_csv/actions/runs/980437758,Org rename 路 UAL-RE/ReQUIAM_csv@9929e2f,1,1
2021-06-30,/UAL-RE/ReQUIAM_csv/pull/79,Org rename by astrochun 路 Pull Request #79 路 UAL-RE/ReQUIAM_csv,1,1
2021-06-30,/UAL-RE/ReQUIAM_csv/pull/79/files,Org rename by astrochun 路 Pull Request #79 路 UAL-RE/ReQUIAM_csv,1,1
2021-06-30,/UAL-RE/ReQUIAM_csv/search,Search 路 UAL-RE,1,1
2021-06-30,/UAL-RE/slacking,UAL-RE/slacking: Experimentation with open-source tools for retrieving Slac...,1,1
2021-06-30,/UAL-RE/uptime,GitHub - UAL-RE/uptime: Uptime monitoring with @upptime,1,1
2021-06-30,/UAL-RE/uptime/commit/db39242245e636089a534c11f205bf146d66a2eb, UA Institutional Repository is up (200 in 656 ms) [skip ci] [upptime] 路 UA...,1,1
