date,path,title,count,uniques
2021-12-19,/UAL-RE/ReM/blob/61aed9b92ecfdd983fd1d05d01bb95c5b5532286/main.py,ReM/main.py at 61aed9b92ecfdd983fd1d05d01bb95c5b5532286 路 UAL-RE/ReM 路 GitHub,6,6
2021-12-19,/UAL-RE/ReM/blob/61aed9b92ecfdd983fd1d05d01bb95c5b5532286/readme_tool/figshare.py,ReM/figshare.py at 61aed9b92ecfdd983fd1d05d01bb95c5b5532286 路 UAL-RE/ReM 路 Gi...,2,2
2021-12-19,/UAL-RE/ReM,UAL-RE/ReM: A Python web UI built on FastAPI to gather metadata to construct ...,1,1
2021-12-19,/UAL-RE/ReQUIAM,UAL-RE/ReQUIAM: Identity and Access Management backend software for UA Resear...,3,2
2021-12-19,/UAL-RE/ReQUIAM/issues/120,Enhancement: PR template 路 Issue #120 路 UAL-RE/ReQUIAM,1,1
2021-12-19,/UAL-RE/ReQUIAM_csv,UAL-RE/ReQUIAM_csv: Construct list of research themes and organization mappin...,1,1
2021-12-19,/UAL-RE/ReQUIAM_csv/commits/master,Commits 路 UAL-RE/ReQUIAM_csv,1,1
2021-12-19,/UAL-RE/uptime/issues/114, UA ORCID is down 路 Issue #114 路 UAL-RE/uptime 路 GitHub,1,1
