date,path,title,count,uniques
2022-06-12,/UAL-RE/redata-iac,UAL-RE/redata-iac: Infrastructure as Code (IaC) resources for ReDATA,1,1
2022-06-12,/UAL-RE/redata-iac/issues,Issues 路 UAL-RE/redata-iac,1,1
2022-06-12,/UAL-RE/redata-iac/issues/33,Unable to run add_ssh_key_file ansible playbook 路 Issue #33 路 UAL-RE/redata-iac,1,1
2022-06-12,/UAL-RE/redata-iac/pulls,Pull requests 路 UAL-RE/redata-iac,1,1
2022-06-12,/UAL-RE/ReQUIAM,UAL-RE/ReQUIAM: Identity and Access Management backend software for UA Resear...,6,3
2022-06-12,/UAL-RE/ReQUIAM/issues,Issues 路 UAL-RE/ReQUIAM,4,1
2022-06-12,/UAL-RE/ReQUIAM/issues/157,Docs: Add CHANGELOG.md 路 Issue #157 路 UAL-RE/ReQUIAM,2,1
2022-06-12,/UAL-RE/ReQUIAM/blob/master/docs/source/getting_started.rst,ReQUIAM/getting_started.rst at master 路 UAL-RE/ReQUIAM,1,1
2022-06-12,/UAL-RE/ReQUIAM/issues/162,Enhancement: quota and group manual CSVs should use persistent_path 路 Issue #...,1,1
2022-06-12,/UAL-RE/ReQUIAM_csv/issues,Issues 路 UAL-RE/ReQUIAM_csv,2,1
2022-06-12,/UAL-RE/ReQUIAM_csv,UAL-RE/ReQUIAM_csv: Construct list of research themes and organization mappin...,1,1
2022-06-12,/UAL-RE/ReQUIAM_csv/issues/31,Comparing Org Code spreadsheets 路 Issue #31 路 UAL-RE/ReQUIAM_csv,1,1
2022-06-12,/UAL-RE/ReQUIAM_csv/issues/36,Generate git commit command for updates to CSV 路 Issue #36 路 UAL-RE/ReQUIAM_csv,1,1
2022-06-12,/UAL-RE/ReQUIAM_csv/issues/37,CSV updates 路 Issue #37 路 UAL-RE/ReQUIAM_csv,1,1
2022-06-12,/UAL-RE/ReQUIAM_csv/issues/72,Chore: Add docs checkmark to PR templates 路 Issue #72 路 UAL-RE/ReQUIAM_csv,1,1
2022-06-12,/UAL-RE/uptime,UAL-RE/uptime: Uptime monitoring with @upptime,3,3
2022-06-12,/UAL-RE/uptime/issues,Issues 路 UAL-RE/uptime,2,1
2022-06-12,/UAL-RE/uptime/issues/126, UA Institutional Repository is down 路 Issue #126 路 UAL-RE/uptime 路 GitHub,1,1
2022-06-12,/UAL-RE/uptime/issues/216, ReDATA (stage) is down 路 Issue #216 路 UAL-RE/uptime,1,1
