date,path,title,count,uniques
2022-06-28,/UAL-RE/figstats/issues,Issues 路 UAL-RE/figstats,2,1
2022-06-28,/UAL-RE/figstats,UAL-RE/figstats: Python software to retrieve statistics for public datasets o...,1,1
2022-06-28,/UAL-RE/figstats/graphs/contributors,Contributors to UAL-RE/figstats,1,1
2022-06-28,/UAL-RE/figstats/issues/1,Main API functionality to query for Figshare stats 路 Issue #1 路 UAL-RE/figstats,1,1
2022-06-28,/UAL-RE/figstats/pulse,Pulse 路 UAL-RE/figstats,1,1
2022-06-28,/UAL-RE/github-stats,UAL-RE/github-stats: GitHub stats for UAL-RE,1,1
2022-06-28,/UAL-RE/LD-Cool-P,UAL-RE/LD-Cool-P: Python tool to enable data curation,8,1
2022-06-28,/UAL-RE/LD-Cool-P/issues,UAL-RE/LD-Cool-P: Python tool to enable data curation,3,1
2022-06-28,/UAL-RE/LD-Cool-P/issues/91,Update README.md for change in Overview 路 Issue #91 路 UAL-RE/LD-Cool-P,3,1
2022-06-28,/UAL-RE/LD-Cool-P/tree/master/ldcoolp/scripts,LD-Cool-P/ldcoolp/scripts at master 路 UAL-RE/LD-Cool-P,2,1
2022-06-28,/UAL-RE/LD-Cool-P/blob/master/ldcoolp/scripts/perform_move,LD-Cool-P/perform_move at master 路 UAL-RE/LD-Cool-P,1,1
2022-06-28,/UAL-RE/LD-Cool-P/blob/master/ldcoolp/scripts/prereq_script,LD-Cool-P/prereq_script at master 路 UAL-RE/LD-Cool-P,1,1
2022-06-28,/UAL-RE/LD-Cool-P/graphs/contributors,Contributors to UAL-RE/LD-Cool-P,1,1
2022-06-28,/UAL-RE/LD-Cool-P/issues/111,GitHub Actions for release gating 路 Issue #111 路 UAL-RE/LD-Cool-P 路 GitHub,1,1
2022-06-28,/UAL-RE/LD-Cool-P/issues/131,Create new GitHub issue template for enhancement 路 Issue #131 路 UAL-RE/LD-Coo...,1,1
2022-06-28,/UAL-RE/LD-Cool-P/issues/162,Bug: Q_EED does not work with Q_PopulateResponse 路 Issue #162 路 UAL-RE/LD-Coo...,1,1
2022-06-28,/UAL-RE/ldcoolp-figshare,UAL-RE/ldcoolp-figshare: Python tool using the Figshare API for data curation,14,2
2022-06-28,/UAL-RE/ldcoolp-figshare/issues,Issues 路 UAL-RE/ldcoolp-figshare,4,2
2022-06-28,/UAL-RE/ldcoolp-figshare/issues/30,Add .idea to exclude in .gitignore 路 Issue #30 路 UAL-RE/ldcoolp-figshare,4,1
2022-06-28,/UAL-RE/ldcoolp-figshare/pull/31,add PyCharm settings .idea to .gitignore by yhan818 路 Pull Request #31 路 UAL-...,2,2
2022-06-28,/UAL-RE/ldcoolp-figshare/pulls,Pull requests 路 UAL-RE/ldcoolp-figshare,2,1
2022-06-28,/UAL-RE/ldcoolp-figshare/branches,Branches 路 UAL-RE/ldcoolp-figshare,1,1
2022-06-28,/UAL-RE/ldcoolp-figshare/commit/2b5109ac97566bd8853fe63aca3524147316ab35,Merge pull request #31 from UAL-RE/chore/30_update_gitignore 路 UAL-RE/ldcoolp...,1,1
2022-06-28,/UAL-RE/ldcoolp-figshare/compare/chore/30_update_gitignore,Comparing main...chore/30_update_gitignore 路 UAL-RE/ldcoolp-figshare,1,1
2022-06-28,/UAL-RE/ldcoolp-figshare/graphs/contributors,Contributors to UAL-RE/ldcoolp-figshare,1,1
2022-06-28,/UAL-RE/ReBACH,UAL-RE/ReBACH: Python-based tool to enable data preservation to a cloud-hoste...,2,2
2022-06-28,/UAL-RE/ReBACH/tree/main/ualrdm-directory-validation,ReBACH/ualrdm-directory-validation at main 路 UAL-RE/ReBACH,2,1
2022-06-28,/UAL-RE/ReBACH/blob/main/ualrdm-directory-validation/directory-validate.py,ReBACH/directory-validate.py at main 路 UAL-RE/ReBACH,1,1
2022-06-28,/UAL-RE/ReBACH/tree/main/ualrdm-directory-validation/tests,ReBACH/ualrdm-directory-validation/tests at main 路 UAL-RE/ReBACH,1,1
2022-06-28,/UAL-RE/ReBACH/tree/main/ualrdm-directory-validation/tests/curation,ReBACH/ualrdm-directory-validation/tests/curation at main 路 UAL-RE/ReBACH,1,1
2022-06-28,/UAL-RE/redata-commons,UAL-RE/redata-commons: Commons code used by ReDATA codebases,22,2
2022-06-28,/UAL-RE/redata-commons/issues,UAL-RE/redata-commons: Commons code used by ReDATA codebases,17,2
2022-06-28,/UAL-RE/redata-commons/actions/workflows/python-package.yml,Actions 路 UAL-RE/redata-commons,3,1
2022-06-28,/UAL-RE/redata-commons/tags,Tags 路 UAL-RE/redata-commons 路 GitHub,2,2
2022-06-28,/UAL-RE/redata-commons/issues/23,Upgrade to Python 3.9 and related dependencies 路 Issue #23 路 UAL-RE/redata-co...,2,1
2022-06-28,/UAL-RE/redata-commons/issues/9,Update README.md for Sphinx documentation 路 Issue #9 路 UAL-RE/redata-commons,2,1
2022-06-28,/UAL-RE/redata-commons/tree/main/redata,redata-commons/redata at main 路 UAL-RE/redata-commons,2,1
2022-06-28,/UAL-RE/redata-commons/tree/main/redata/commons,redata-commons/redata/commons at main 路 UAL-RE/redata-commons,2,1
2022-06-28,/UAL-ODIS/redata-commons/issues/9,Update README.md for Sphinx documentation 路 Issue #9 路 UAL-RE/redata-commons,1,1
2022-06-28,/UAL-RE/redata-commons/actions,Upgrade to Python 3.9 and related dependencies 路 Issue #23 路 UAL-RE/redata-co...,1,1
2022-06-28,/UAL-RE/redata-docs,UAL-RE/redata-docs: A repo to serve general documentation regarding ReDATA so...,19,3
2022-06-28,/UAL-RE/redata-docs/issues,Issues 路 UAL-RE/redata-docs,11,1
2022-06-28,/UAL-RE/redata-docs/tags,Tags 路 UAL-RE/redata-docs 路 GitHub,3,2
2022-06-28,/UAL-RE/redata-docs/pull/27,updating tagging section for project-management.rst by yhan818 路 Pull Request...,3,1
2022-06-28,/UAL-RE/redata-docs/pulls,Pull requests 路 UAL-RE/redata-docs,3,1
2022-06-28,/UAL-RE/redata-docs/issues/9,Add page for data curation overview 路 Issue #9 路 UAL-RE/redata-docs,2,1
2022-06-28,/UAL-RE/redata-docs/blob/main/.gitignore,redata-docs/.gitignore at main 路 UAL-RE/redata-docs,1,1
2022-06-28,/UAL-RE/redata-docs/commit/4ac0e0d895d19d52df6ee5d096288d10338c8da1,Merge pull request #27 from UAL-RE/tagging-project-management 路 UAL-RE/redata...,1,1
2022-06-28,/UAL-RE/redata-docs/compare/789c122ecea7...4ac0e0d895d1,Comparing 789c122ecea7...4ac0e0d895d1 路 UAL-RE/redata-docs,1,1
2022-06-28,/UAL-RE/redata-docs/compare/tagging-project-management,Comparing main...tagging-project-management 路 UAL-RE/redata-docs,1,1
2022-06-28,/UAL-RE/redata-iac,UAL-RE/redata-iac: Infrastructure as Code (IaC) resources for ReDATA,1,1
2022-06-28,/UAL-RE/redata-iac/blob/4929ae72961cd2b7b240ac1f97348255b0ad1baf/ansible/bashrc_requiam_alias_setup.yml,redata-iac/bashrc_requiam_alias_setup.yml at 4929ae72961cd2b7b240ac1f97348255...,1,1
2022-06-28,/UAL-RE/redata-iac/issues,Issues 路 UAL-RE/redata-iac,1,1
2022-06-28,/UAL-RE/redata-iac/pulls,Pull requests 路 UAL-RE/redata-iac,1,1
2022-06-28,/UAL-RE/redata-landing-page,UAL-RE/redata-landing-page: Redirect to main ReDATA site,1,1
2022-06-28,/UAL-RE/redata-landing-page/blob/landing-page/index.html,redata-landing-page/index.html at landing-page 路 UAL-RE/redata-landing-page,1,1
2022-06-28,/UAL-RE/redata-landing-page/blob/landing-page/README.md,redata-landing-page/README.md at landing-page 路 UAL-RE/redata-landing-page,1,1
2022-06-28,/UAL-RE/redata-landing-page/branches,Branches 路 UAL-RE/redata-landing-page,1,1
2022-06-28,/UAL-RE/redata-landing-page/tree/landing-page/assets,redata-landing-page/assets at landing-page 路 UAL-RE/redata-landing-page,1,1
2022-06-28,/UAL-RE/redata-landing-page/tree/landing-page/assets/vendor,redata-landing-page/assets/vendor at landing-page 路 UAL-RE/redata-landing-page,1,1
2022-06-28,/UAL-RE/ReQUIAM/issues,Issues 路 UAL-RE/ReQUIAM,53,2
2022-06-28,/UAL-RE/ReQUIAM,UAL-RE/ReQUIAM: Identity and Access Management backend software for UA Resear...,43,3
2022-06-28,/UAL-RE/ReQUIAM/actions,issue 170. update to python 3.9 路 UAL-RE/ReQUIAM@25c788f,22,1
2022-06-28,/UAL-RE/ReQUIAM/issues/170,Enhancement: Update to Python 3.9 路 Issue #170 路 UAL-RE/ReQUIAM,17,1
2022-06-28,/UAL-RE/ReQUIAM/pulls,Pull requests 路 UAL-RE/ReQUIAM,14,1
2022-06-28,/UAL-RE/ReQUIAM/issues/160,Update README.md for RTDs information 路 Issue #160 路 UAL-RE/ReQUIAM,11,1
2022-06-28,/UAL-RE/ReQUIAM/pull/171,issue 170. update to python 3.9 by yhan818 路 Pull Request #171 路 UAL-RE/ReQUIAM,9,1
2022-06-28,/UAL-RE/ReQUIAM/actions/workflows/python-package.yml,Actions 路 UAL-RE/ReQUIAM,7,1
2022-06-28,/UAL-RE/ReQUIAM/issues/166,Enhancement: update RTD documentation 路 Issue #166 路 UAL-RE/ReQUIAM,6,1
2022-06-28,/UAL-RE/ReQUIAM/pull/171/commits,issue 170. update to python 3.9 by yhan818 路 Pull Request #171 路 UAL-RE/ReQUIAM,5,1
2022-06-28,/UAL-RE/ReQUIAM_csv,UAL-RE/ReQUIAM_csv: Construct list of research themes and organization mappin...,22,2
2022-06-28,/UAL-RE/ReQUIAM_csv/issues,UAL-RE/ReQUIAM_csv: Construct list of research themes and organization mappin...,21,1
2022-06-28,/UAL-RE/ReQUIAM_csv/issues/36,Generate git commit command for updates to CSV 路 Issue #36 路 UAL-RE/ReQUIAM_csv,8,2
2022-06-28,/UAL-RE/ReQUIAM_csv/issues/72,Chore: Add docs checkmark to PR templates 路 Issue #72 路 UAL-RE/ReQUIAM_csv,8,1
2022-06-28,/UAL-RE/ReQUIAM_csv/issues/75,Docs: Update README.md to Avoid Duplicates with Docs 路 Issue #75 路 UAL-RE/ReQ...,6,1
2022-06-28,/UAL-RE/ReQUIAM_csv/issues/66,Sphinx documentation with RTDs 路 Issue #66 路 UAL-RE/ReQUIAM_csv,5,1
2022-06-28,/UAL-RE/ReQUIAM_csv/community,Community Standards,4,1
2022-06-28,/UAL-RE/ReQUIAM_csv/graphs/contributors,Contributors to UAL-RE/ReQUIAM_csv,4,1
2022-06-28,/UAL-RE/ReQUIAM_csv/issues/new,New Issue 路 UAL-RE/ReQUIAM_csv,4,1
2022-06-28,/UAL-RE/ReQUIAM_csv/tree/documentation/75_update_README,UAL-RE/ReQUIAM_csv at documentation/75_update_README,4,1
2022-06-28,/UAL-RE/slacking,UAL-RE/slacking: Experimentation with open-source tools for retrieving Slack ...,5,1
2022-06-28,/UAL-RE/slacking/actions,Actions 路 UAL-RE/slacking,1,1
2022-06-28,/UAL-RE/slacking/blob/master/README.md,slacking/README.md at master 路 UAL-RE/slacking,1,1
2022-06-28,/UAL-RE/slacking/branches,Branches 路 UAL-RE/slacking,1,1
2022-06-28,/UAL-RE/slacking/graphs/contributors,Contributors to UAL-RE/slacking,1,1
2022-06-28,/UAL-RE/slacking/issues,Issues 路 UAL-RE/slacking,1,1
2022-06-28,/UAL-RE/slacking/pulls,Pull requests 路 UAL-RE/slacking,1,1
2022-06-28,/UAL-RE/slacking/pulse,Pulse 路 UAL-RE/slacking,1,1
2022-06-28,/UAL-RE/UAL-RE,UAL-RE/UAL-RE: About the UAL-RE organization,2,1
2022-06-28,/UAL-RE/uptime,UAL-RE/uptime: Uptime monitoring with @upptime,9,2
2022-06-28,/UAL-RE/uptime/issues,Issues 路 UAL-RE/uptime,7,2
2022-06-28,/UAL-RE/uptime/issues/226, Afghan Respository is down 路 Issue #226 路 UAL-RE/uptime,7,2
2022-06-28,/UAL-RE/uptime/pull/227,Update .upptimerc.yml by yhan818 路 Pull Request #227 路 UAL-RE/uptime,5,2
2022-06-28,/UAL-RE/uptime/blob/master/.upptimerc.yml,uptime/.upptimerc.yml at master 路 UAL-RE/uptime,3,2
2022-06-28,/UAL-RE/uptime/pulls,Pull requests 路 UAL-RE/uptime,3,2
2022-06-28,/UAL-RE/uptime/compare/master...yhan818:patch-1,Comparing UAL-RE:master...yhan818:patch-1 路 UAL-RE/uptime,3,1
2022-06-28,/UAL-RE/uptime/tree/gh-pages,UAL-RE/uptime at gh-pages,3,1
2022-06-28,/UAL-RE/uptime/branches,Branches 路 UAL-RE/uptime,2,1
2022-06-28,/UAL-RE/uptime/commits/master,Commits 路 UAL-RE/uptime,2,1
