date,path,title,count,uniques
2022-09-22,/UAL-RE/ReQUIAM,UAL-RE/ReQUIAM: Identity and Access Management backend software for UA Resear...,4,1
2022-09-22,/UAL-RE/ReQUIAM/issues,Issues 路 UAL-RE/ReQUIAM,3,1
2022-09-22,/UAL-RE/ReQUIAM/issues/170,Enhancement: Update to Python 3.9 路 Issue #170 路 UAL-RE/ReQUIAM,1,1
2022-09-22,/UAL-RE/ReQUIAM/issues/46,Comment field in manual override CSV files 路 Issue #46 路 UAL-RE/ReQUIAM,1,1
2022-09-22,/UAL-RE/ReQUIAM_csv,UAL-RE/ReQUIAM_csv: Construct list of research themes and organization mappin...,4,2
2022-09-22,/UAL-RE/ReQUIAM_csv/issues,Issues 路 UAL-RE/ReQUIAM_csv,3,1
2022-09-22,/UAL-RE/uptime/issues/226, Afghan Respository is down 路 Issue #226 路 UAL-RE/uptime,1,1
