date,path,title,count,uniques
2023-03-07,/UAL-RE/redata-iac/issues,Issues 路 UAL-RE/redata-iac,12,1
2023-03-07,/UAL-RE/redata-iac,UAL-RE/redata-iac: Infrastructure as Code (IaC) resources for ReDATA,6,1
2023-03-07,/UAL-RE/redata-iac/issues/49,Update documentation README 路 Issue #49 路 UAL-RE/redata-iac,6,1
2023-03-07,/UAL-RE/redata-iac/compare/documentation/49,Comparing master...documentation/49 路 UAL-RE/redata-iac,3,1
2023-03-07,/UAL-RE/redata-iac/issues/39,Add documentation of playbooks and roles and unix scripts 路 Issue #39 路 UAL-R...,2,1
2023-03-07,/UAL-RE/redata-iac/issues/43,doctl_backup.sh: implement notifications 路 Issue #43 路 UAL-RE/redata-iac,2,1
2023-03-07,/UAL-RE/redata-iac/issues/44,doctl_backup.sh: upgrade DigitalOcean token 路 Issue #44 路 UAL-RE/redata-iac,2,1
2023-03-07,/UAL-RE/redata-iac/pull/50,Documentation/49 by yhan818 路 Pull Request #50 路 UAL-RE/redata-iac,2,1
2023-03-07,/UAL-RE/redata-iac/issues/37,Add ansible playbook to add helpme for redata-iac 路 Issue #37 路 UAL-RE/redata...,1,1
2023-03-07,/UAL-RE/redata-iac/pulls,Pull requests 路 UAL-RE/redata-iac,1,1
2023-03-07,/UAL-RE/uptime/issues/306, ReDATA (stage) is down 路 Issue #306 路 UAL-RE/uptime,1,1
